172,Customized Pallet Truck,Customized Pallet Truck Manufacturer in India/Gujarat/Ahmedabad,"Get our customized pallet truck for a tailored solution to meet your unique material handling needs. We can design and build a pallet truck that fits your specific requirements, including load capacity, fork length, and width, as well as special features such as lifting platforms or attachments.Buy it now!"
173,Electric High Lift Pallet Trcuk,Electric High Lift Pallet Trcuk Manufacturer in India/Gujarat/Ahmedabad,"Get our electric motor and adjustable forks, our pallet truck can lift loads to a maximum height of 31.5 inches, reducing the risk of injuries caused by manual lifting.Buy it now!"
174,Heavy Duty Pallet Truck (5000 kgs),Heavy Duty Pallet Truck (5000 kgs) Manufacturer in India/Gujarat/Ahmedabad,"Get our heavy-duty pallet truck with a load capacity  and robust and reliable solution to handle large and heavy loads in your warehouse or factory. With its durable construction, reinforced forks, and easy-to-use hydraulic pump, our pallet truck can move heavy loads with minimal effort, increasing efficiency and productivity. Buy it now!"
175,High Lift Pallet Truck,High Lift Pallet Truck Manufacturer in India/Gujarat/Ahmedabad,"Get our high lift pallet truck for a safe and efficient solution to move and lift heavy loads up to 2200lbs to a maximum height of 31.5 inches, reducing the risk of injuries caused by manual lifting.Buy it now!"
176,Hybrid Pallet Truck,Hybrid Pallet Truck Manufacturer in India/Gujarat/Ahmedabad,"Get our hybrid pallet truck for a versatile and eco-friendly solution.With its electric motor and hydraulic pump, our pallet truck can operate in electric or manual mode, reducing energy consumption and increasing efficiency. Buy it now!"
177,Hybrid Hand Pallet Truck,Hybrid Hand Pallet Truck Manufacturer in India/Gujarat/Ahmedabad,"Get our hybrid hand pallet truck for a versatile and eco-friendly solution to move and lift heavy loads. With its electric motor and hydraulic pump, our pallet truck can operate in electric or manual mode, reducing energy consumption and increasing efficiency. Buy it now!"
178,Mini Battery Operated Pallet Truck,Mini Battery Operated Pallet Truck Manufacturer in India/Gujarat/Ahmedabad,Get our mini battery-operated pallet truck for a compact and efficient solution to move and lift loads in tight spaces.  Buy it now!
179,Pallet Truck with Cargo Backrest,Pallet Truck with Cargo Backrest Manufacturer in India/Gujarat/Ahmedabad,"Get our pallet truck with a cargo backrest for a safe and stable solution to transport palletized loads in your warehouse or distribution center. The backrest prevents the load from shifting or falling during transport, reducing the risk of damage to goods and injuries to operators.Buy it now!"
180,Pallet Trucks Spares,Pallet Trucks Spares Manufacturer in India/Gujarat/Ahmedabad,"Get our pallet truck spares for a quick and reliable solution to repair and maintain your pallet trucks, ensuring their optimal performance and longevity. Buy it now!"
181,Roll Lift Pallet Truck,Roll Lift Pallet Truck Manufacturer in India/Gujarat/Ahmedabad,"Get our roll lift pallet truck for a versatile and efficient solution to move and lift cylindrical loads, such as rolls of paper, carpet, or fabric. The special design of the forks allows them to wrap around the roll and lift it securely, preventing it from rolling or slipping during transport. Buy it now!"
182,Stainless Steel Pallet Truck,Stainless Steel Pallet Truck Manufacturer in India/Gujarat/Ahmedabad,"Get our stainless steel pallet truck for a durable and hygienic solution to move and lift loads in corrosive or cleanroom environments. Made of high-quality stainless steel, our pallet truck is resistant to rust, corrosion, and contamination, ensuring compliance with strict hygiene standards.Buy it now!"
183,Weighing Scale Pallet Truck,Weighing Scale Pallet Truck Manufacturer in India/Gujarat/Ahmedabad,Get our weighing scale pallet truck for a convenient and accurate solution to weigh your loads while moving them. Buy it now!
184,Polyurethane Rebonding Service,Polyurethane Rebonding Service  Manufacturer in India/Gujarat/Ahmedabad,"Get our polyurethane rebonding service for a cost-effective and sustainable solution to restore and enhance the performance of your worn-out or damaged polyurethane products, such as wheels, rollers, bumpers, or pads.Buy it now!"
185,Polyurethane Traction / Drive Wheels,Polyurethane Traction / Drive Wheels  Manufacturer in India/Gujarat/Ahmedabad,"Get our polyurethane traction/drive wheels for a reliable and high-performance solution to move your heavy loads with ease and safety. Made of premium-quality polyurethane, our traction/drive wheels provide excellent traction, abrasion resistance, and shock absorption, reducing the risk of slippage, wear and tear, and damage to your floors and equipment. Buy it now!"
186,Polyurethane Wheels,Polyurethane Wheels  Manufacturer in India/Gujarat/Ahmedabad,"Get our polyurethane wheels for a durable, non-marking, and versatile solution to your material handling needs, suitable for various applications and equipment types.Buy it now!"
187,Counterbalance Fully powered Drum Stacker,Counterbalance Fully powered Drum Stacker Manufacturer in India/Gujarat/Ahmedabad,"Get our fully powered drum stacker for a safe, effortless, and efficient handling of your drums, with a counterbalance design that ensures stability and prevents tipping.Buy it now!"
188,Counterbalance Semi powered Drum Stacker,Counterbalance Semi powered Drum Stacker Manufacturer in India/Gujarat/Ahmedabad,"Get our semi-powered drum stacker with counterbalance for a cost-effective and ergonomic solution to lift and transport your drums, with adjustable forks and various lifting heights to meet your specific needs.Buy it now!"
189,Electric Reach Stacker,Electric Reach Stacker Manufacturer in India/Gujarat/Ahmedabad,"Get our electric reach stacker for a versatile and efficient solution to lift and stack heavy loads up to great heights, with customizable options and advanced safety features.Buy it now!"
190,Flameproof Electric Drum Stacker,Flameproof Electric Drum Stacker Manufacturer in India/Gujarat/Ahmedabad,Get our flameproof electric drum stacker for a safe and reliable solution to handle flammable materials in hazardous environments.Buy it now!
191,Flameproof Electric Stacker,Flameproof Electric Stacker Manufacturer in India/Gujarat/Ahmedabad,Get our Flameproof Electric Stacker to ensure safety in hazardous environments.Buy it now!
192,Fully Electric Stacker,Fully Electric Stacker Manufacturer in India/Gujarat/Ahmedabad,"Get our fully electric stacker for efficient and effortless handling of heavy loads in your warehouse or industrial setting. With advanced features and high-quality construction, it offers reliable performance and durability.Buy it now!"
193,Fully Powered Drum Stacker,Fully Powered Drum Stacker Manufacturer in India/Gujarat/Ahmedabad,Get our fully powered drum stacker for effortless lifting and transport of heavy drums in your workplace.Buy it now!
194,Hook Stacker,Hook Stacker Manufacturer in India/Gujarat/Ahmedabad,"Get our Hook Stacker, designed to lift and move heavy loads with ease and precision, making it an ideal solution for various material handling applications.Buy it now!"
195,Hydraulic Roller Stacker,Hydraulic Roller Stacker Manufacturer in India/Gujarat/Ahmedabad,"Get our Hydraulic Roller Stacker to efficiently move and stack materials with ease, and improve productivity in your workspace.Buy it now!"
196,Manual Drum Stacker,Manual Drum Stacker Manufacturer in India/Gujarat/Ahmedabad,Get our Manual Drum Stacker for efficient and easy handling of drums in your workplace.Buy it now!
197,Manual Drum Stacker (V- Shape Base),Manual Drum Stacker (V- Shape Base) Manufacturer in India/Gujarat/Ahmedabad,"Get our manual drum stacker with a V-shaped base for easy lifting and transporting of drums, without the need for power or electricity.Buy it now!"
198,Manual Hydraulic Stacker,Manual Hydraulic Stacker Manufacturer in India/Gujarat/Ahmedabad,Get our Manual Hydraulic Stacker for easy and efficient lifting of heavy loads with hydraulic lifting. No electricity or battery required.Buy it now!
199,Paper  Reel Stacker,Paper  Reel Stacker Manufacturer in India/Gujarat/Ahmedabad,Get our Paper Reel Stacker for efficient handling of paper rolls with ease and safety. No more manual lifting or transport required.Buy it now!
200,Semi Electric Stacker,Semi Electric Stacker Manufacturer in India/Gujarat/Ahmedabad,Get our Semi Electric Stacker for efficient and effortless lifting and moving of heavy loads in your workplace.Buy it now!
201,Semi Power Drum Stacker,Semi Power Drum Stacker Manufacturer in India/Gujarat/Ahmedabad,"Get our Semi-Powered Drum Stacker for a versatile and efficient solution to lift, transport and stack drums in your workspace.Buy it now!"
202,Semi Power Drum Stacker (V- Shaped Base),Semi Power Drum Stacker (V- Shaped Base) Manufacturer in India/Gujarat/Ahmedabad,"Get our Semi-Power Drum Stacker with a V-shaped base for easy maneuvering and lifting of drums, increasing efficiency in your workplace. Buy it now!"
203,Straddle Leg Manual Stacker,Straddle Leg Manual Stacker Manufacturer in India/Gujarat/Ahmedabad,Get our Straddle Leg Manual Stacker for easy lifting and transportation of heavy loads with minimal manual effort. Perfect for warehouses and industrial settings.Buy it now!
